{
  "$schema": "../schema/agents-manifest.schema.json",
  "manifestVersion": 1,
  "profile": { "source": "profile/base.md" },
  "catalog": [
    { "id": "afd-workbench-principles", "kind": "skill", "source": "catalog/skills/afd-workbench-principles" }
  ],
  "targets": [
    { "agent": "claude-code", "entries": ["afd-workbench-principles"], "profile": true }
  ]
}
